{
  "schemaVersion": 1,
  "name": "go-tools/duplicate-boundary/benchmark-fields-trailing-decoy",
  "source": {
    "repository": "https://go.googlesource.com/tools",
    "license": "BSD-3-Clause",
    "commit": "ed9ed918a1e0aad1ed54642e4a8f1c90b34b6b49"
  },
  "initialFiles": {
    "benchmark/parse/parse.go": "// Copyright 2014 The Go Authors. All rights reserved.\n// Use of this source code is governed by a BSD-style\n// license that can be found in the LICENSE file.\n\n// Package parse provides support for parsing benchmark results as\n// generated by 'go test -bench'.\npackage parse // import \"golang.org/x/tools/benchmark/parse\"\n\nimport (\n\t\"bufio\"\n\t\"bytes\"\n\t\"fmt\"\n\t\"io\"\n\t\"strconv\"\n\t\"strings\"\n)\n\n// Flags used by Benchmark.Measured to indicate\n// which measurements a Benchmark contains.\nconst (\n\tNsPerOp = 1 << iota\n\tMBPerS\n\tAllocedBytesPerOp\n\tAllocsPerOp\n)\n\n// Benchmark is one run of a single benchmark.\ntype Benchmark struct {\n\tName              string  // benchmark name\n\tN                 int     // number of iterations\n\tNsPerOp           float64 // nanoseconds per iteration\n\tAllocedBytesPerOp uint64  // bytes allocated per iteration\n\tAllocsPerOp       uint64  // allocs per iteration\n\tMBPerS            float64 // MB processed per second\n\tMeasured          int     // which measurements were recorded\n\tOrd               int     // ordinal position within a benchmark run\n}\n\n// ParseLine extracts a Benchmark from a single line of testing.B\n// output.\nfunc ParseLine(line string) (*Benchmark, error) {\n\tfields := strings.Fields(line)\n\n\t// Two required, positional fields: Name and iterations.\n\tif len(fields) < 2 {\n\t\treturn nil, fmt.Errorf(\"two fields required, have %d\", len(fields))\n\t}\n\tif !strings.HasPrefix(fields[0], \"Benchmark\") {\n\t\treturn nil, fmt.Errorf(`first field does not start with \"Benchmark\"`)\n\t}\n\tn, err := strconv.Atoi(fields[1])\n\tif err != nil {\n\t\treturn nil, err\n\t}\n\tb := &Benchmark{Name: fields[0], N: n}\n\n\t// Parse any remaining pairs of fields; we've parsed one pair already.\n\tfor i := 1; i < len(fields)/2; i++ {\n\t\tb.parseMeasurement(fields[i*2], fields[i*2+1])\n\t}\n\treturn b, nil\n}\n\nfunc (b *Benchmark) parseMeasurement(quant string, unit string) {\n\tswitch unit {\n\tcase \"ns/op\":\n\t\tif f, err := strconv.ParseFloat(quant, 64); err == nil {\n\t\t\tb.NsPerOp = f\n\t\t\tb.Measured |= NsPerOp\n\t\t}\n\tcase \"MB/s\":\n\t\tif f, err := strconv.ParseFloat(quant, 64); err == nil {\n\t\t\tb.MBPerS = f\n\t\t\tb.Measured |= MBPerS\n\t\t}\n\tcase \"B/op\":\n\t\tif i, err := strconv.ParseUint(quant, 10, 64); err == nil {\n\t\t\tb.AllocedBytesPerOp = i\n\t\t\tb.Measured |= AllocedBytesPerOp\n\t\t}\n\tcase \"allocs/op\":\n\t\tif i, err := strconv.ParseUint(quant, 10, 64); err == nil {\n\t\t\tb.AllocsPerOp = i\n\t\t\tb.Measured |= AllocsPerOp\n\t\t}\n\t}\n}\n\nfunc (b *Benchmark) String() string {\n\tbuf := new(bytes.Buffer)\n\tfmt.Fprintf(buf, \"%s %d\", b.Name, b.N)\n\tif (b.Measured & NsPerOp) != 0 {\n\t\tfmt.Fprintf(buf, \" %.2f ns/op\", b.NsPerOp)\n\t}\n\tif (b.Measured & MBPerS) != 0 {\n\t\tfmt.Fprintf(buf, \" %.2f MB/s\", b.MBPerS)\n\t}\n\tif (b.Measured & AllocedBytesPerOp) != 0 {\n\t\tfmt.Fprintf(buf, \" %d B/op\", b.AllocedBytesPerOp)\n\t}\n\tif (b.Measured & AllocsPerOp) != 0 {\n\t\tfmt.Fprintf(buf, \" %d allocs/op\", b.AllocsPerOp)\n\t}\n\treturn buf.String()\n}\n\n// Set is a collection of benchmarks from one\n// testing.B run, keyed by name to facilitate comparison.\ntype Set map[string][]*Benchmark\n\n// ParseSet extracts a Set from testing.B output.\n// ParseSet preserves the order of benchmarks that have identical\n// names.\nfunc ParseSet(r io.Reader) (Set, error) {\n\tbb := make(Set)\n\tscan := bufio.NewScanner(r)\n\tord := 0\n\tfor scan.Scan() {\n\t\tif b, err := ParseLine(scan.Text()); err == nil {\n\t\t\tb.Ord = ord\n\t\t\tord++\n\t\t\tbb[b.Name] = append(bb[b.Name], b)\n\t\t}\n\t}\n\n\tif err := scan.Err(); err != nil {\n\t\treturn nil, err\n\t}\n\n\treturn bb, nil\n}\n"
  },
  "events": [
    {
      "type": "read",
      "path": "benchmark/parse/parse.go",
      "scope": "region",
      "startLine": 29,
      "endLine": 36,
      "selector": "Benchmark.fields"
    },
    {
      "type": "capture-request",
      "task": "review Benchmark fields",
      "budgetChars": 12000,
      "requiredUnits": [
        {
          "path": "benchmark/parse/parse.go",
          "selector": "Benchmark.fields",
          "sha256": "4e8c2b5c87f6c314493c32b1385e3b8f8846119ad8f2da863c98dcaafef142d7"
        }
      ]
    },
    {
      "type": "replace-exact",
      "path": "benchmark/parse/parse.go",
      "expected": "const (\n\tNsPerOp = 1 << iota\n\tMBPerS\n\tAllocedBytesPerOp\n\tAllocsPerOp\n)\n\n// Benchmark is one run of a single benchmark.\ntype Benchmark struct {\n\tName              string  // benchmark name\n\tN                 int     // number of iterations\n\tNsPerOp           float64 // nanoseconds per iteration\n\tAllocedBytesPerOp uint64  // bytes allocated per iteration\n\tAllocsPerOp       uint64  // allocs per iteration\n\tMBPerS            float64 // MB processed per second\n\tMeasured          int     // which measurements were recorded\n\tOrd               int     // ordinal position within a benchmark run\n}",
      "replacement": "\tName              string  // benchmark name\n\tN                 int     // number of iterations\n\tNsPerOp           float64 // nanoseconds per iteration\n\tAllocedBytesPerOp uint64  // bytes allocated per iteration\n\tAllocsPerOp       uint64  // allocs per iteration\n\tMBPerS            float64 // MB processed per second\n\tMeasured          int     // which measurements were recorded\n\tOrd               int     // ordinal position within a benchmark run\ntype Benchmark struct {\n\t// lab-dup-boundary gap 01\n\t// lab-dup-boundary gap 02\n\t// lab-dup-boundary gap 03\n\t// lab-dup-boundary gap 04\n\t// lab-dup-boundary gap 05\n\t// lab-dup-boundary gap 06\n\t// lab-dup-boundary gap 07\n\t// lab-dup-boundary gap 08\n}"
    },
    {
      "type": "replace-exact",
      "path": "benchmark/parse/parse.go",
      "expected": "\n}\n\n// ParseLine extracts a Benchmark from a single line of testing.B",
      "replacement": "\n}\n\tName              string  // benchmark name\n\tN                 int     // number of iterations\n\tNsPerOp           float64 // nanoseconds per iteration\n\tAllocedBytesPerOp uint64  // bytes allocated per iteration\n\tAllocsPerOp       uint64  // allocs per iteration\n\tMBPerS            float64 // MB processed per second\n\tMeasured          int     // which measurements were recorded\n\tOrd               int     // ordinal position within a benchmark run\n\n// ParseLine extracts a Benchmark from a single line of testing.B"
    },
    {
      "type": "replace-exact",
      "path": "benchmark/parse/parse.go",
      "expected": "// ParseLine extracts a Benchmark from a single line of testing.B",
      "replacement": "\tOrd               int     // ordinal position within a benchmark run\n\n// ParseLine extracts a Benchmark from a single line of testing.B"
    },
    {
      "type": "capture-request",
      "task": "review Benchmark fields",
      "budgetChars": 12000,
      "requiredUnits": []
    }
  ]
}
