{
  "schemaVersion": 1,
  "name": "express/interior-edit/create-application",
  "source": {
    "repository": "https://github.com/expressjs/express.git",
    "commit": "a3714473feb3d2908add734d340e7755fd85e0a3",
    "license": "MIT"
  },
  "initialFiles": {
    "lib/express.js": "/*!\n * express\n * Copyright(c) 2009-2013 TJ Holowaychuk\n * Copyright(c) 2013 Roman Shtylman\n * Copyright(c) 2014-2015 Douglas Christopher Wilson\n * MIT Licensed\n */\n\n'use strict';\n\n/**\n * Module dependencies.\n */\n\nvar bodyParser = require('body-parser')\nvar EventEmitter = require('node:events').EventEmitter;\nvar mixin = require('merge-descriptors');\nvar proto = require('./application');\nvar Router = require('router');\nvar req = require('./request');\nvar res = require('./response');\n\n/**\n * Expose `createApplication()`.\n */\n\nexports = module.exports = createApplication;\n\n/**\n * Create an express application.\n *\n * @return {Function}\n * @api public\n */\n\nfunction createApplication() {\n  var app = function(req, res, next) {\n    app.handle(req, res, next);\n  };\n\n  mixin(app, EventEmitter.prototype, false);\n  mixin(app, proto, false);\n\n  // expose the prototype that will get set on requests\n  app.request = Object.create(req, {\n    app: { configurable: true, enumerable: true, writable: true, value: app }\n  })\n\n  // expose the prototype that will get set on responses\n  app.response = Object.create(res, {\n    app: { configurable: true, enumerable: true, writable: true, value: app }\n  })\n\n  app.init();\n  return app;\n}\n\n/**\n * Expose the prototypes.\n */\n\nexports.application = proto;\nexports.request = req;\nexports.response = res;\n\n/**\n * Expose constructors.\n */\n\nexports.Route = Router.Route;\nexports.Router = Router;\n\n/**\n * Expose middleware\n */\n\nexports.json = bodyParser.json\nexports.raw = bodyParser.raw\nexports.static = require('serve-static');\nexports.text = bodyParser.text\nexports.urlencoded = bodyParser.urlencoded\n"
  },
  "events": [
    {
      "type": "read",
      "path": "lib/express.js",
      "scope": "region",
      "startLine": 36,
      "endLine": 56,
      "selector": "createApplication"
    },
    {
      "type": "capture-request",
      "task": "review application factory",
      "budgetChars": 12000,
      "requiredUnits": [
        {
          "path": "lib/express.js",
          "selector": "createApplication",
          "sha256": "1700da5f6e24bf4f2e1aebc8e286c182d18de0477e41c835d99db5705517f354"
        }
      ]
    },
    {
      "type": "replace-exact",
      "path": "lib/express.js",
      "expected": "  // expose the prototype that will get set on requests",
      "replacement": "  // expose the request prototype used by the application"
    },
    {
      "type": "capture-request",
      "task": "review application factory",
      "budgetChars": 12000,
      "requiredUnits": [
        {
          "path": "lib/express.js",
          "selector": "createApplication",
          "sha256": "eb0c335b2f27bf012a9094141d6bc2ccbd75133dbed5d248fc4e6662cf34ce8a"
        }
      ]
    }
  ]
}
