{
  "schemaVersion": 1,
  "name": "go-tools/duplicate-boundary/containing-package-sig",
  "source": {
    "repository": "https://go.googlesource.com/tools",
    "commit": "ed9ed918a1e0aad1ed54642e4a8f1c90b34b6b49",
    "license": "BSD-3-Clause"
  },
  "initialFiles": {
    "go/buildutil/util.go": "// Copyright 2014 The Go Authors. All rights reserved.\n// Use of this source code is governed by a BSD-style\n// license that can be found in the LICENSE file.\n\npackage buildutil\n\nimport (\n\t\"fmt\"\n\t\"go/ast\"\n\t\"go/build\"\n\t\"go/parser\"\n\t\"go/token\"\n\t\"io\"\n\t\"io/ioutil\"\n\t\"os\"\n\t\"path\"\n\t\"path/filepath\"\n\t\"strings\"\n)\n\n// ParseFile behaves like parser.ParseFile,\n// but uses the build context's file system interface, if any.\n//\n// If file is not absolute (as defined by IsAbsPath), the (dir, file)\n// components are joined using JoinPath; dir must be absolute.\n//\n// The displayPath function, if provided, is used to transform the\n// filename that will be attached to the ASTs.\n//\n// TODO(adonovan): call this from go/loader.parseFiles when the tree thaws.\nfunc ParseFile(fset *token.FileSet, ctxt *build.Context, displayPath func(string) string, dir string, file string, mode parser.Mode) (*ast.File, error) {\n\tif !IsAbsPath(ctxt, file) {\n\t\tfile = JoinPath(ctxt, dir, file)\n\t}\n\trd, err := OpenFile(ctxt, file)\n\tif err != nil {\n\t\treturn nil, err\n\t}\n\tdefer rd.Close() // ignore error\n\tif displayPath != nil {\n\t\tfile = displayPath(file)\n\t}\n\treturn parser.ParseFile(fset, file, rd, mode)\n}\n\n// ContainingPackage returns the package containing filename.\n//\n// If filename is not absolute, it is interpreted relative to working directory dir.\n// All I/O is via the build context's file system interface, if any.\n//\n// The '...Files []string' fields of the resulting build.Package are not\n// populated (build.FindOnly mode).\nfunc ContainingPackage(ctxt *build.Context, dir, filename string) (*build.Package, error) {\n\tif !IsAbsPath(ctxt, filename) {\n\t\tfilename = JoinPath(ctxt, dir, filename)\n\t}\n\n\t// We must not assume the file tree uses\n\t// \"/\" always,\n\t// `\\` always,\n\t// or os.PathSeparator (which varies by platform),\n\t// but to make any progress, we are forced to assume that\n\t// paths will not use `\\` unless the PathSeparator\n\t// is also `\\`, thus we can rely on filepath.ToSlash for some sanity.\n\n\tdirSlash := path.Dir(filepath.ToSlash(filename)) + \"/\"\n\n\t// We assume that no source root (GOPATH[i] or GOROOT) contains any other.\n\tfor _, srcdir := range ctxt.SrcDirs() {\n\t\tsrcdirSlash := filepath.ToSlash(srcdir) + \"/\"\n\t\tif importPath, ok := HasSubdir(ctxt, srcdirSlash, dirSlash); ok {\n\t\t\treturn ctxt.Import(importPath, dir, build.FindOnly)\n\t\t}\n\t}\n\n\treturn nil, fmt.Errorf(\"can't find package containing %s\", filename)\n}\n\n// -- Effective methods of file system interface -------------------------\n\n// (go/build.Context defines these as methods, but does not export them.)\n\n// HasSubdir calls ctxt.HasSubdir (if not nil) or else uses\n// the local file system to answer the question.\nfunc HasSubdir(ctxt *build.Context, root, dir string) (rel string, ok bool) {\n\tif f := ctxt.HasSubdir; f != nil {\n\t\treturn f(root, dir)\n\t}\n\n\t// Try using paths we received.\n\tif rel, ok = hasSubdir(root, dir); ok {\n\t\treturn\n\t}\n\n\t// Try expanding symlinks and comparing\n\t// expanded against unexpanded and\n\t// expanded against expanded.\n\trootSym, _ := filepath.EvalSymlinks(root)\n\tdirSym, _ := filepath.EvalSymlinks(dir)\n\n\tif rel, ok = hasSubdir(rootSym, dir); ok {\n\t\treturn\n\t}\n\tif rel, ok = hasSubdir(root, dirSym); ok {\n\t\treturn\n\t}\n\treturn hasSubdir(rootSym, dirSym)\n}\n\nfunc hasSubdir(root, dir string) (rel string, ok bool) {\n\tconst sep = string(filepath.Separator)\n\troot = filepath.Clean(root)\n\tif !strings.HasSuffix(root, sep) {\n\t\troot += sep\n\t}\n\n\tdir = filepath.Clean(dir)\n\tif !strings.HasPrefix(dir, root) {\n\t\treturn \"\", false\n\t}\n\n\treturn filepath.ToSlash(dir[len(root):]), true\n}\n\n// FileExists returns true if the specified file exists,\n// using the build context's file system interface.\nfunc FileExists(ctxt *build.Context, path string) bool {\n\tif ctxt.OpenFile != nil {\n\t\tr, err := ctxt.OpenFile(path)\n\t\tif err != nil {\n\t\t\treturn false\n\t\t}\n\t\tr.Close() // ignore error\n\t\treturn true\n\t}\n\t_, err := os.Stat(path)\n\treturn err == nil\n}\n\n// OpenFile behaves like os.Open,\n// but uses the build context's file system interface, if any.\nfunc OpenFile(ctxt *build.Context, path string) (io.ReadCloser, error) {\n\tif ctxt.OpenFile != nil {\n\t\treturn ctxt.OpenFile(path)\n\t}\n\treturn os.Open(path)\n}\n\n// IsAbsPath behaves like filepath.IsAbs,\n// but uses the build context's file system interface, if any.\nfunc IsAbsPath(ctxt *build.Context, path string) bool {\n\tif ctxt.IsAbsPath != nil {\n\t\treturn ctxt.IsAbsPath(path)\n\t}\n\treturn filepath.IsAbs(path)\n}\n\n// JoinPath behaves like filepath.Join,\n// but uses the build context's file system interface, if any.\nfunc JoinPath(ctxt *build.Context, path ...string) string {\n\tif ctxt.JoinPath != nil {\n\t\treturn ctxt.JoinPath(path...)\n\t}\n\treturn filepath.Join(path...)\n}\n\n// IsDir behaves like os.Stat plus IsDir,\n// but uses the build context's file system interface, if any.\nfunc IsDir(ctxt *build.Context, path string) bool {\n\tif ctxt.IsDir != nil {\n\t\treturn ctxt.IsDir(path)\n\t}\n\tfi, err := os.Stat(path)\n\treturn err == nil && fi.IsDir()\n}\n\n// ReadDir behaves like ioutil.ReadDir,\n// but uses the build context's file system interface, if any.\nfunc ReadDir(ctxt *build.Context, path string) ([]os.FileInfo, error) {\n\tif ctxt.ReadDir != nil {\n\t\treturn ctxt.ReadDir(path)\n\t}\n\treturn ioutil.ReadDir(path)\n}\n\n// SplitPathList behaves like filepath.SplitList,\n// but uses the build context's file system interface, if any.\nfunc SplitPathList(ctxt *build.Context, s string) []string {\n\tif ctxt.SplitPathList != nil {\n\t\treturn ctxt.SplitPathList(s)\n\t}\n\treturn filepath.SplitList(s)\n}\n\n// sameFile returns true if x and y have the same basename and denote\n// the same file.\nfunc sameFile(x, y string) bool {\n\tif path.Clean(x) == path.Clean(y) {\n\t\treturn true\n\t}\n\tif filepath.Base(x) == filepath.Base(y) { // (optimisation)\n\t\tif xi, err := os.Stat(x); err == nil {\n\t\t\tif yi, err := os.Stat(y); err == nil {\n\t\t\t\treturn os.SameFile(xi, yi)\n\t\t\t}\n\t\t}\n\t}\n\treturn false\n}\n"
  },
  "events": [
    {
      "type": "read",
      "path": "go/buildutil/util.go",
      "scope": "region",
      "startLine": 46,
      "endLine": 53,
      "selector": "ContainingPackage.sig"
    },
    {
      "type": "capture-request",
      "task": "resolve duplicated ContainingPackage signatures",
      "budgetChars": 12000,
      "requiredUnits": [
        {
          "path": "go/buildutil/util.go",
          "selector": "ContainingPackage.sig",
          "sha256": "af4650ec068d5f291412bdb53b1bc4eeb078e0d2476ab1533d7f87ea0ef468db"
        }
      ]
    },
    {
      "type": "replace-exact",
      "path": "go/buildutil/util.go",
      "expected": "// ContainingPackage returns the package containing filename.\n//\n// If filename is not absolute, it is interpreted relative to working directory dir.\n// All I/O is via the build context's file system interface, if any.\n//\n// The '...Files []string' fields of the resulting build.Package are not\n// populated (build.FindOnly mode).\nfunc ContainingPackage(ctxt *build.Context, dir, filename string) (*build.Package, error) {",
      "replacement": "// ContainingPackage returns the package containing filename.\n//\n// If filename is not absolute, it is interpreted relative to working directory dir.\n// All I/O is via the build context's file system interface, if any.\n//\n// The '...Files []string' fields of the resulting build.Package are not\n// populated (build.FindOnly mode).\nfunc ContainingPackage(ctxt *build.Context, dir, filename string) (*build.Package, error) {\n\n// ContainingPackageDuplicate is an intentional duplicate-boundary holdout mutation.\nfunc ContainingPackageDuplicate(ctxt *build.Context, dir, filename string) (*build.Package, error) {\n\treturn ContainingPackage(ctxt, dir, filename)\n}\n"
    },
    {
      "type": "capture-request",
      "task": "resolve duplicated ContainingPackage signatures",
      "budgetChars": 12000,
      "requiredUnits": []
    }
  ]
}
