{
  "schemaVersion": 1,
  "name": "flask/append/view-class-doc",
  "source": {
    "repository": "https://github.com/pallets/flask.git",
    "commit": "d318b683471101618febed18996405ad26462110",
    "license": "BSD-3-Clause"
  },
  "initialFiles": {
    "src/flask/views.py": "from __future__ import annotations\n\nimport typing as t\n\nfrom . import typing as ft\nfrom .globals import current_app\nfrom .globals import request\n\nF = t.TypeVar(\"F\", bound=t.Callable[..., t.Any])\n\nhttp_method_funcs = frozenset(\n    [\"get\", \"query\", \"post\", \"head\", \"options\", \"delete\", \"put\", \"trace\", \"patch\"]\n)\n\n\nclass View:\n    \"\"\"Subclass this class and override :meth:`dispatch_request` to\n    create a generic class-based view. Call :meth:`as_view` to create a\n    view function that creates an instance of the class with the given\n    arguments and calls its ``dispatch_request`` method with any URL\n    variables.\n\n    See :doc:`views` for a detailed guide.\n\n    .. code-block:: python\n\n        class Hello(View):\n            init_every_request = False\n\n            def dispatch_request(self, name):\n                return f\"Hello, {name}!\"\n\n        app.add_url_rule(\n            \"/hello/<name>\", view_func=Hello.as_view(\"hello\")\n        )\n\n    Set :attr:`methods` on the class to change what methods the view\n    accepts.\n\n    Set :attr:`decorators` on the class to apply a list of decorators to\n    the generated view function. Decorators applied to the class itself\n    will not be applied to the generated view function!\n\n    Set :attr:`init_every_request` to ``False`` for efficiency, unless\n    you need to store request-global data on ``self``.\n    \"\"\"\n\n    #: The methods this view is registered for. Uses the same default\n    #: (``[\"GET\", \"HEAD\", \"OPTIONS\"]``) as ``route`` and\n    #: ``add_url_rule`` by default.\n    methods: t.ClassVar[t.Collection[str] | None] = None\n\n    #: Control whether the ``OPTIONS`` method is handled automatically.\n    #: Uses the same default (``True``) as ``route`` and\n    #: ``add_url_rule`` by default.\n    provide_automatic_options: t.ClassVar[bool | None] = None\n\n    #: A list of decorators to apply, in order, to the generated view\n    #: function. Remember that ``@decorator`` syntax is applied bottom\n    #: to top, so the first decorator in the list would be the bottom\n    #: decorator.\n    #:\n    #: .. versionadded:: 0.8\n    decorators: t.ClassVar[list[t.Callable[..., t.Any]]] = []\n\n    #: Create a new instance of this view class for every request by\n    #: default. If a view subclass sets this to ``False``, the same\n    #: instance is used for every request.\n    #:\n    #: A single instance is more efficient, especially if complex setup\n    #: is done during init. However, storing data on ``self`` is no\n    #: longer safe across requests, and :data:`~flask.g` should be used\n    #: instead.\n    #:\n    #: .. versionadded:: 2.2\n    init_every_request: t.ClassVar[bool] = True\n\n    def dispatch_request(self) -> ft.ResponseReturnValue:\n        \"\"\"The actual view function behavior. Subclasses must override\n        this and return a valid response. Any variables from the URL\n        rule are passed as keyword arguments.\n        \"\"\"\n        raise NotImplementedError()\n\n    @classmethod\n    def as_view(\n        cls, name: str, *class_args: t.Any, **class_kwargs: t.Any\n    ) -> ft.RouteCallable:\n        \"\"\"Convert the class into a view function that can be registered\n        for a route.\n\n        By default, the generated view will create a new instance of the\n        view class for every request and call its\n        :meth:`dispatch_request` method. If the view class sets\n        :attr:`init_every_request` to ``False``, the same instance will\n        be used for every request.\n\n        Except for ``name``, all other arguments passed to this method\n        are forwarded to the view class ``__init__`` method.\n\n        .. versionchanged:: 2.2\n            Added the ``init_every_request`` class attribute.\n        \"\"\"\n        if cls.init_every_request:\n\n            def view(**kwargs: t.Any) -> ft.ResponseReturnValue:\n                self = view.view_class(  # type: ignore[attr-defined]\n                    *class_args, **class_kwargs\n                )\n                return current_app.ensure_sync(self.dispatch_request)(**kwargs)  # type: ignore[no-any-return]\n\n        else:\n            self = cls(*class_args, **class_kwargs)  # pyright: ignore\n\n            def view(**kwargs: t.Any) -> ft.ResponseReturnValue:\n                return current_app.ensure_sync(self.dispatch_request)(**kwargs)  # type: ignore[no-any-return]\n\n        if cls.decorators:\n            view.__name__ = name\n            view.__module__ = cls.__module__\n            for decorator in cls.decorators:\n                view = decorator(view)\n\n        # We attach the view class to the view function for two reasons:\n        # first of all it allows us to easily figure out what class-based\n        # view this thing came from, secondly it's also used for instantiating\n        # the view class so you can actually replace it with something else\n        # for testing purposes and debugging.\n        view.view_class = cls  # type: ignore\n        view.__name__ = name\n        view.__doc__ = cls.__doc__\n        view.__module__ = cls.__module__\n        view.methods = cls.methods  # type: ignore\n        view.provide_automatic_options = cls.provide_automatic_options  # type: ignore\n        return view\n\n\nclass MethodView(View):\n    \"\"\"Dispatches request methods to the corresponding instance methods.\n    For example, if you implement a ``get`` method, it will be used to\n    handle ``GET`` requests.\n\n    This can be useful for defining a REST API.\n\n    :attr:`methods` is automatically set based on the methods defined on\n    the class.\n\n    See :doc:`views` for a detailed guide.\n\n    .. code-block:: python\n\n        class CounterAPI(MethodView):\n            def get(self):\n                return str(session.get(\"counter\", 0))\n\n            def post(self):\n                session[\"counter\"] = session.get(\"counter\", 0) + 1\n                return redirect(url_for(\"counter\"))\n\n        app.add_url_rule(\n            \"/counter\", view_func=CounterAPI.as_view(\"counter\")\n        )\n    \"\"\"\n\n    def __init_subclass__(cls, **kwargs: t.Any) -> None:\n        super().__init_subclass__(**kwargs)\n\n        if \"methods\" not in cls.__dict__:\n            methods = set()\n\n            for base in cls.__bases__:\n                if getattr(base, \"methods\", None):\n                    methods.update(base.methods)  # type: ignore[attr-defined]\n\n            for key in http_method_funcs:\n                if hasattr(cls, key):\n                    methods.add(key.upper())\n\n            if methods:\n                cls.methods = methods\n\n    def dispatch_request(self, **kwargs: t.Any) -> ft.ResponseReturnValue:\n        meth = getattr(self, request.method.lower(), None)\n\n        # If the request method is HEAD and we don't have a handler for it\n        # retry with GET.\n        if meth is None and request.method == \"HEAD\":\n            meth = getattr(self, \"get\", None)\n\n        assert meth is not None, f\"Unimplemented method {request.method!r}\"\n        return current_app.ensure_sync(meth)(**kwargs)  # type: ignore[no-any-return]\n"
  },
  "events": [
    {
      "type": "read",
      "path": "src/flask/views.py",
      "scope": "region",
      "startLine": 17,
      "endLine": 46,
      "selector": "View.doc"
    },
    {
      "type": "capture-request",
      "task": "inspect class-based view documentation",
      "budgetChars": 12000,
      "requiredUnits": [
        {
          "path": "src/flask/views.py",
          "selector": "View.doc",
          "sha256": "900b0fb378f7f254e42277423a55f138bf760249a644badbc2665a21f6292af6"
        }
      ]
    },
    {
      "type": "replace-exact",
      "path": "src/flask/views.py",
      "expected": "class View:",
      "replacement": "# smoke-append marker\n\nclass View:"
    },
    {
      "type": "capture-request",
      "task": "inspect class-based view documentation",
      "budgetChars": 12000,
      "requiredUnits": [
        {
          "path": "src/flask/views.py",
          "selector": "View.doc",
          "sha256": "900b0fb378f7f254e42277423a55f138bf760249a644badbc2665a21f6292af6"
        }
      ]
    }
  ]
}
