{
  "schemaVersion": 1,
  "name": "neovim/append/compute-hash-header",
  "source": {
    "repository": "https://github.com/neovim/neovim.git",
    "commit": "2dd6e9d6a2482069cfe9d12a09f761c5713f246b",
    "license": "Apache-2.0"
  },
  "initialFiles": {
    "runtime/lua/vim/secure.lua": "local M = {}\n\n--- Reads trust database from $XDG_STATE_HOME/nvim/trust.\n---\n---@return table<string, string> Contents of trust database, if it exists. Empty table otherwise.\nlocal function read_trust()\n  local trust = {} ---@type table<string, string>\n  local f = io.open(vim.fn.stdpath('state') .. '/trust', 'r')\n  if f then\n    local contents = f:read('*a')\n    if contents then\n      for line in vim.gsplit(contents, '\\n') do\n        local hash, file = string.match(line, '^(%S+) (.+)$')\n        if hash and file then\n          trust[file] = hash\n        end\n      end\n    end\n    f:close()\n  end\n  return trust\nend\n\n--- If {fullpath} is a file, read the contents of {fullpath} (or the contents of {bufnr}\n--- if given) and returns the contents and a hash of the contents.\n---\n--- If {fullpath} is a directory, then nothing is read from the filesystem, and\n--- `contents = true` and `hash = \"directory\"` is returned instead.\n---\n---@param fullpath string Path to a file or directory to read.\n---@param bufnr integer? The number of the buffer.\n---@return string|boolean? contents the contents of the file, or true if it's a directory\n---@return string? hash the hash of the contents, or \"directory\" if it's a directory\nlocal function compute_hash(fullpath, bufnr)\n  local contents ---@type string|boolean?\n  local hash ---@type string\n  if vim.fn.isdirectory(fullpath) == 1 then\n    return true, 'directory'\n  end\n\n  if bufnr then\n    local is_unchanged_empty = vim.api.nvim_buf_call(bufnr, function()\n      return not vim.bo[bufnr].modified and vim.fn.line2byte(1) == -1\n    end)\n    if is_unchanged_empty then\n      contents = ''\n    else\n      local newline = vim.bo[bufnr].fileformat == 'unix' and '\\n' or '\\r\\n'\n      contents =\n        table.concat(vim.api.nvim_buf_get_lines(bufnr --[[@as integer]], 0, -1, false), newline)\n      if vim.bo[bufnr].endofline then\n        contents = contents .. newline\n      end\n    end\n  else\n    do\n      local f = io.open(fullpath, 'rb')\n      if not f then\n        return nil, nil\n      end\n      contents = f:read('*a')\n      f:close()\n    end\n\n    if not contents then\n      return nil, nil\n    end\n  end\n\n  hash = vim.fn.sha256(contents)\n\n  return contents, hash\nend\n\n--- Writes provided {trust} table to trust database at\n--- $XDG_STATE_HOME/nvim/trust.\n---\n---@param trust table<string, string> Trust table to write\nlocal function write_trust(trust)\n  vim.validate('trust', trust, 'table')\n  local f = assert(io.open(vim.fn.stdpath('state') .. '/trust', 'w'))\n\n  local t = {} ---@type string[]\n  for p, h in pairs(trust) do\n    t[#t + 1] = string.format('%s %s\\n', h, p)\n  end\n  f:write(table.concat(t))\n  f:close()\nend\n\n--- If {path} is a file: attempt to read the file, prompting the user if the file should be\n--- trusted.\n---\n--- If {path} is a directory: return true if the directory is trusted (non-recursive), prompting\n--- the user as necessary.\n---\n--- The user's choice is persisted in a trust database at\n--- $XDG_STATE_HOME/nvim/trust.\n---\n---@since 11\n---@see |:trust|\n---\n---@param path (string) Path to a file or directory to read.\n---\n---@return (boolean|string|nil) If {path} is not trusted or does not exist, returns `nil`. Otherwise,\n---        returns the contents of {path} if it is a file, or true if {path} is a directory.\nfunction M.read(path)\n  vim.validate('path', path, 'string')\n  local fullpath = vim.uv.fs_realpath(vim.fs.normalize(path))\n  if not fullpath then\n    return nil\n  end\n  fullpath = vim.fs.normalize(fullpath) -- Ensure \"/\" slashes, even on Windows.\n\n  local trust = read_trust()\n\n  if trust[fullpath] == '!' then\n    -- File is denied\n    return nil\n  end\n\n  local contents, hash = compute_hash(fullpath, nil)\n  if not contents then\n    return nil\n  end\n\n  if trust[fullpath] == hash then\n    -- File already exists in trust database\n    return contents\n  end\n\n  local msg2 = ' To enable it, choose (v)iew then run `:trust`:'\n  local choices = '&ignore\\n&view\\n&deny'\n  if hash == 'directory' then\n    msg2 = ' DIRECTORY trust is decided only by name, not contents:'\n    choices = '&ignore\\n&view\\n&deny\\n&allow'\n  end\n\n  -- File either does not exist in trust database or the hash does not match\n  local ok, result = pcall(\n    vim.fn.confirm,\n    string.format('exrc: Found untrusted code.%s\\n%s', msg2, fullpath),\n    choices,\n    1\n  )\n\n  if not ok and result ~= 'Keyboard interrupt' then\n    error(result)\n  elseif not ok or result == 0 or result == 1 then\n    -- Cancelled or ignored\n    return nil\n  elseif result == 2 then\n    -- View\n    vim.cmd(('sview %s'):format(vim.fn.fnameescape(fullpath)))\n    return nil\n  elseif result == 3 then\n    -- Deny\n    trust[fullpath] = '!'\n    contents = nil\n  elseif hash == 'directory' and result == 4 then\n    -- Allow\n    trust[fullpath] = hash\n  end\n\n  write_trust(trust)\n\n  return contents\nend\n\n--- @class vim.trust.opts\n--- @inlinedoc\n---\n--- One of:\n---   - `'allow'` to add a file to the trust database and trust it,\n---   - `'deny'` to add a file to the trust database and deny it,\n---   - `'remove'` to remove file from the trust database\n--- @field action 'allow'|'deny'|'remove'\n---\n--- Path to a file to update. Mutually exclusive with {bufnr}.\n--- @field path? string\n--- Buffer number to update. Mutually exclusive with {path}.\n--- @field bufnr? integer\n\n--- Manage the trust database.\n---\n--- The trust database is located at |$XDG_STATE_HOME|/nvim/trust.\n---\n---@since 11\n---@param opts vim.trust.opts\n---@return boolean success true if operation was successful\n---@return string msg full path if operation was successful, else error message\nfunction M.trust(opts)\n  vim.validate('path', opts.path, 'string', true)\n  vim.validate('bufnr', opts.bufnr, 'number', true)\n  vim.validate('action', opts.action, function(m)\n    return m == 'allow' or m == 'deny' or m == 'remove'\n  end, [[\"allow\" or \"deny\" or \"remove\"]])\n\n  ---@cast opts vim.trust.opts\n  local path = opts.path\n  local bufnr = opts.bufnr\n  local action = opts.action\n\n  assert(not path or not bufnr, '\"path\" and \"bufnr\" are mutually exclusive')\n\n  local fullpath ---@type string?\n  if path then\n    fullpath = vim.uv.fs_realpath(vim.fs.normalize(path))\n  elseif bufnr then\n    local bufname = vim.api.nvim_buf_get_name(bufnr)\n    if bufname == '' then\n      return false, 'buffer is not associated with a file'\n    end\n    fullpath = vim.uv.fs_realpath(vim.fs.normalize(bufname))\n  else\n    error('one of \"path\" or \"bufnr\" is required')\n  end\n\n  if not fullpath then\n    return false, string.format('invalid path: %s', path)\n  end\n  fullpath = vim.fs.normalize(fullpath) -- Ensure \"/\" slashes, even on Windows.\n\n  local trust = read_trust()\n\n  if action == 'allow' then\n    local contents, hash = compute_hash(fullpath, bufnr)\n    if not contents then\n      return false, string.format('could not read path: %s', fullpath)\n    end\n\n    trust[fullpath] = hash\n  elseif action == 'deny' then\n    trust[fullpath] = '!'\n  elseif action == 'remove' then\n    trust[fullpath] = nil\n  end\n\n  write_trust(trust)\n  return true, fullpath\nend\n\nreturn M\n"
  },
  "events": [
    {
      "type": "read",
      "path": "runtime/lua/vim/secure.lua",
      "scope": "region",
      "startLine": 24,
      "endLine": 34,
      "selector": "compute_hash.header"
    },
    {
      "type": "capture-request",
      "task": "inspect compute_hash helper",
      "budgetChars": 12000,
      "requiredUnits": [
        {
          "path": "runtime/lua/vim/secure.lua",
          "selector": "compute_hash.header",
          "sha256": "3f9bb38bc6a55cf47d48ac110a385923dee793e470d52211a9ae08c64b6a5db7"
        }
      ]
    },
    {
      "type": "replace-exact",
      "path": "runtime/lua/vim/secure.lua",
      "expected": "local function compute_hash(fullpath, bufnr)",
      "replacement": "-- holdout-append marker\n\nlocal function compute_hash(fullpath, bufnr)"
    },
    {
      "type": "capture-request",
      "task": "inspect compute_hash helper",
      "budgetChars": 12000,
      "requiredUnits": [
        {
          "path": "runtime/lua/vim/secure.lua",
          "selector": "compute_hash.header",
          "sha256": "e37107fd55b137ac7012810752890311b4e12a0d92a0e5198de6f263062fa5d8"
        }
      ]
    }
  ]
}
